[
  {
    "customer_id": "C00000001",
    "signup_date": "2023-08-23",
    "age_band": "25-34",
    "region_code": "KHU",
    "kyc_level": "verified",
    "acquisition_channel": "app"
  },
  {
    "customer_id": "C00000002",
    "signup_date": "2023-06-14",
    "age_band": "55+",
    "region_code": "CTG",
    "kyc_level": "verified",
    "acquisition_channel": "referral"
  },
  {
    "customer_id": "C00000003",
    "signup_date": "2022-07-27",
    "age_band": "45-54",
    "region_code": "DHK",
    "kyc_level": "limited",
    "acquisition_channel": "app"
  },
  {
    "customer_id": "C00000004",
    "signup_date": "2023-08-20",
    "age_band": "18-24",
    "region_code": "CTG",
    "kyc_level": "verified",
    "acquisition_channel": "app"
  },
  {
    "customer_id": "C00000005",
    "signup_date": "2022-11-11",
    "age_band": "25-34",
    "region_code": "RAJ",
    "kyc_level": "verified",
    "acquisition_channel": "referral"
  },
  {
    "customer_id": "C00000006",
    "signup_date": "2022-08-16",
    "age_band": "18-24",
    "region_code": "DHK",
    "kyc_level": "verified",
    "acquisition_channel": "app"
  },
  {
    "customer_id": "C00000007",
    "signup_date": "2024-01-11",
    "age_band": "18-24",
    "region_code": "SYL",
    "kyc_level": "limited",
    "acquisition_channel": "app"
  },
  {
    "customer_id": "C00000008",
    "signup_date": "2024-01-26",
    "age_band": "35-44",
    "region_code": "DHK",
    "kyc_level": "verified",
    "acquisition_channel": "referral"
  },
  {
    "customer_id": "C00000009",
    "signup_date": "2024-01-20",
    "age_band": "18-24",
    "region_code": "CTG",
    "kyc_level": "verified",
    "acquisition_channel": "app"
  },
  {
    "customer_id": "C00000010",
    "signup_date": "2022-05-01",
    "age_band": "25-34",
    "region_code": "CTG",
    "kyc_level": "verified",
    "acquisition_channel": "agent"
  },
  {
    "customer_id": "C00000011",
    "signup_date": "2023-04-18",
    "age_band": "25-34",
    "region_code": "CTG",
    "kyc_level": "verified",
    "acquisition_channel": "agent"
  },
  {
    "customer_id": "C00000012",
    "signup_date": "2024-01-29",
    "age_band": "25-34",
    "region_code": "DHK",
    "kyc_level": "verified",
    "acquisition_channel": "referral"
  },
  {
    "customer_id": "C00000013",
    "signup_date": "2024-01-23",
    "age_band": "35-44",
    "region_code": "RAJ",
    "kyc_level": "verified",
    "acquisition_channel": "app"
  },
  {
    "customer_id": "C00000014",
    "signup_date": "2022-06-04",
    "age_band": "25-34",
    "region_code": "SYL",
    "kyc_level": "verified",
    "acquisition_channel": "referral"
  },
  {
    "customer_id": "C00000015",
    "signup_date": "2023-06-19",
    "age_band": "35-44",
    "region_code": "DHK",
    "kyc_level": "limited",
    "acquisition_channel": "referral"
  },
  {
    "customer_id": "C00000016",
    "signup_date": "2023-11-10",
    "age_band": "18-24",
    "region_code": "BAR",
    "kyc_level": "verified",
    "acquisition_channel": "app"
  },
  {
    "customer_id": "C00000017",
    "signup_date": "2022-10-15",
    "age_band": "18-24",
    "region_code": "CTG",
    "kyc_level": "limited",
    "acquisition_channel": "referral"
  },
  {
    "customer_id": "C00000018",
    "signup_date": "2022-08-07",
    "age_band": "35-44",
    "region_code": "RAJ",
    "kyc_level": "limited",
    "acquisition_channel": "agent"
  },
  {
    "customer_id": "C00000019",
    "signup_date": "2022-11-27",
    "age_band": "18-24",
    "region_code": "CTG",
    "kyc_level": "verified",
    "acquisition_channel": "agent"
  },
  {
    "customer_id": "C00000020",
    "signup_date": "2023-03-16",
    "age_band": "45-54",
    "region_code": "CTG",
    "kyc_level": "verified",
    "acquisition_channel": "agent"
  },
  {
    "customer_id": "C00000021",
    "signup_date": "2022-11-03",
    "age_band": "25-34",
    "region_code": "DHK",
    "kyc_level": "verified",
    "acquisition_channel": "referral"
  },
  {
    "customer_id": "C00000022",
    "signup_date": "2023-10-26",
    "age_band": "45-54",
    "region_code": "DHK",
    "kyc_level": "limited",
    "acquisition_channel": "referral"
  },
  {
    "customer_id": "C00000023",
    "signup_date": "2022-11-28",
    "age_band": "18-24",
    "region_code": "DHK",
    "kyc_level": "verified",
    "acquisition_channel": "app"
  },
  {
    "customer_id": "C00000024",
    "signup_date": "2022-03-19",
    "age_band": "35-44",
    "region_code": "DHK",
    "kyc_level": "limited",
    "acquisition_channel": "agent"
  },
  {
    "customer_id": "C00000025",
    "signup_date": "2024-01-03",
    "age_band": "18-24",
    "region_code": "DHK",
    "kyc_level": "verified",
    "acquisition_channel": "app"
  },
  {
    "customer_id": "C00000026",
    "signup_date": "2023-02-06",
    "age_band": "55+",
    "region_code": "DHK",
    "kyc_level": "verified",
    "acquisition_channel": "agent"
  },
  {
    "customer_id": "C00000027",
    "signup_date": "2024-01-06",
    "age_band": "55+",
    "region_code": "DHK",
    "kyc_level": "limited",
    "acquisition_channel": "agent"
  },
  {
    "customer_id": "C00000028",
    "signup_date": "2022-04-23",
    "age_band": "45-54",
    "region_code": "BAR",
    "kyc_level": "verified",
    "acquisition_channel": "app"
  },
  {
    "customer_id": "C00000029",
    "signup_date": "2023-01-09",
    "age_band": "25-34",
    "region_code": "DHK",
    "kyc_level": "limited",
    "acquisition_channel": "app"
  },
  {
    "customer_id": "C00000030",
    "signup_date": "2023-03-19",
    "age_band": "25-34",
    "region_code": "DHK",
    "kyc_level": "verified",
    "acquisition_channel": "agent"
  },
  {
    "customer_id": "C00000031",
    "signup_date": "2023-09-07",
    "age_band": "25-34",
    "region_code": "RAN",
    "kyc_level": "verified",
    "acquisition_channel": "referral"
  },
  {
    "customer_id": "C00000032",
    "signup_date": "2024-01-10",
    "age_band": "18-24",
    "region_code": "CTG",
    "kyc_level": "limited",
    "acquisition_channel": "app"
  },
  {
    "customer_id": "C00000033",
    "signup_date": "2023-01-29",
    "age_band": "18-24",
    "region_code": "DHK",
    "kyc_level": "verified",
    "acquisition_channel": "app"
  },
  {
    "customer_id": "C00000034",
    "signup_date": "2023-06-03",
    "age_band": "55+",
    "region_code": "BAR",
    "kyc_level": "verified",
    "acquisition_channel": "agent"
  },
  {
    "customer_id": "C00000035",
    "signup_date": "2022-08-26",
    "age_band": "18-24",
    "region_code": "DHK",
    "kyc_level": "verified",
    "acquisition_channel": "app"
  },
  {
    "customer_id": "C00000036",
    "signup_date": "2022-08-12",
    "age_band": "25-34",
    "region_code": "RAJ",
    "kyc_level": "verified",
    "acquisition_channel": "referral"
  },
  {
    "customer_id": "C00000037",
    "signup_date": "2023-08-10",
    "age_band": "25-34",
    "region_code": "DHK",
    "kyc_level": "verified",
    "acquisition_channel": "app"
  },
  {
    "customer_id": "C00000038",
    "signup_date": "2024-01-23",
    "age_band": "55+",
    "region_code": "BAR",
    "kyc_level": "verified",
    "acquisition_channel": "app"
  },
  {
    "customer_id": "C00000039",
    "signup_date": "2024-01-08",
    "age_band": "25-34",
    "region_code": "DHK",
    "kyc_level": "verified",
    "acquisition_channel": "app"
  },
  {
    "customer_id": "C00000040",
    "signup_date": "2023-09-21",
    "age_band": "25-34",
    "region_code": "SYL",
    "kyc_level": "verified",
    "acquisition_channel": "app"
  },
  {
    "customer_id": "C00000041",
    "signup_date": "2023-08-01",
    "age_band": "25-34",
    "region_code": "CTG",
    "kyc_level": "verified",
    "acquisition_channel": "agent"
  },
  {
    "customer_id": "C00000042",
    "signup_date": "2023-11-10",
    "age_band": "25-34",
    "region_code": "DHK",
    "kyc_level": "verified",
    "acquisition_channel": "app"
  },
  {
    "customer_id": "C00000043",
    "signup_date": "2022-04-18",
    "age_band": "35-44",
    "region_code": "CTG",
    "kyc_level": "verified",
    "acquisition_channel": "referral"
  },
  {
    "customer_id": "C00000044",
    "signup_date": "2022-04-11",
    "age_band": "25-34",
    "region_code": "SYL",
    "kyc_level": "verified",
    "acquisition_channel": "agent"
  },
  {
    "customer_id": "C00000045",
    "signup_date": "2024-01-23",
    "age_band": "25-34",
    "region_code": "RAJ",
    "kyc_level": "verified",
    "acquisition_channel": "app"
  },
  {
    "customer_id": "C00000046",
    "signup_date": "2023-10-05",
    "age_band": "18-24",
    "region_code": "CTG",
    "kyc_level": "verified",
    "acquisition_channel": "agent"
  },
  {
    "customer_id": "C00000047",
    "signup_date": "2024-01-13",
    "age_band": "35-44",
    "region_code": "DHK",
    "kyc_level": "verified",
    "acquisition_channel": "referral"
  },
  {
    "customer_id": "C00000048",
    "signup_date": "2022-06-01",
    "age_band": "18-24",
    "region_code": "DHK",
    "kyc_level": "verified",
    "acquisition_channel": "app"
  },
  {
    "customer_id": "C00000049",
    "signup_date": "2023-07-01",
    "age_band": "35-44",
    "region_code": "CTG",
    "kyc_level": "verified",
    "acquisition_channel": "app"
  },
  {
    "customer_id": "C00000050",
    "signup_date": "2023-05-21",
    "age_band": "25-34",
    "region_code": "DHK",
    "kyc_level": "verified",
    "acquisition_channel": "app"
  },
  {
    "customer_id": "C00000051",
    "signup_date": "2023-04-11",
    "age_band": "35-44",
    "region_code": "BAR",
    "kyc_level": "limited",
    "acquisition_channel": "app"
  },
  {
    "customer_id": "C00000052",
    "signup_date": "2022-12-06",
    "age_band": "35-44",
    "region_code": "BAR",
    "kyc_level": "verified",
    "acquisition_channel": "app"
  },
  {
    "customer_id": "C00000053",
    "signup_date": "2022-09-12",
    "age_band": "18-24",
    "region_code": "DHK",
    "kyc_level": "limited",
    "acquisition_channel": "app"
  },
  {